,Unnamed: 0,utterance,expected
370,889,yeah sure,unknown
371,759,Ok no problem I left a voicemail   So hopefully they get back to me this week,unknown
372,143,(To apply as a tenant),applicationProcess
373,782,Thank you for reaching out! Yeah I was able to talk to someone earlier.... I will be there 😬,tourBooking
374,529,Oh ok yes I don't have any pets at the moment only one occupant,unknown
375,1154,"My budget would be $900, move in date would be April 15th, 1 occupant",unitAssignment
376,487,Stop,unknown
377,1310,I was wondering how much are y'all studios,unitAssignment
378,1053,or actually the weekend of the 19th/20th would be better,tourBooking
379,644,"Yes, I would like to schedule a tour",tourBooking
380,572,Ok sounds good thanks. And is there any security deposit discount available?,deposit
381,89,Do you allow domestic animals,pet
382,744,how much and when can i move in,unitAssignment
383,439,be park extra,parking
384,259,Can you share property website link,propertyWebsiteLink
385,977,Can you provide me an online tour?,virtualTour
386,751,I want to cancel the tour,tourCancellation
387,299,Sunday would work too :),tourBooking
388,683,Do you allow lease guarantors?,leaseGaurantor
389,1428,I'm looking for something more of $2200 or less,wantsLessExpensiveUnit
390,516,I meant today at 2:45.,unknown
391,924,Can you show me the property on a video call,virtualTour
392,1105,Had to do something for my job !,unknown
393,1140,I'd love to set up a time to go look at this property,tourBooking
394,666,I am looking for two bedrooms and two bathrooms,unitAssignment
395,527,"Is electricity, water, heating, trash, internet, gas included",utility
396,758,0-bcce-26e6dd5fb92e&bsft_pid=fce702a5-625b-4905-84b9-ff13b512ee06&utm_campaign=1-week-reminder-for-viewed-in-last-day&utm_source=blueshift&utm_medium=email&bsft,unknown
397,333,what is included in the common area,commonAreas
398,1285,My first question would be. Do you accept applicants with broken lease?,evictionPolicy
399,102,I am looking for 3 bedroom,unitAssignment
400,539,12,unknown
401,526,When can I come see the apartments and I wanted to inquire if you might have a 3 bedroom available,unitAssignment
402,433,12:00 PM,unknown
403,967,Additional info.,unknown
404,1165,when do -PRON- have the place for rent and how much be -PRON-,unitAssignment
405,1438,I want to cancel,tourCancelled
406,1309,I would like to know how much is a 2b 2b?,unitAssignment
407,1187,can i come for tour?,tourBooking
408,724,Do you have a video tour i can see,virtualTour
409,1222,"Yes , what does it take to get in ? Money wise I mean",moveInCost
410,294,How many,total_units
411,959,Yes,unknown
412,461,"If this is a robot, 2 bedroom 1 bath april 26th 2022",unitAssignment
413,242,I was hoping to take a look today. Is that possible?,tourBooking
414,919,"Are pets allowed
",pet
415,1373,How much 1 bed,unitAssignment
416,1095,1 bedroom next month,unitAssignment
417,544,Yes that's fine.. February! 1 bed/ 1bath. No children nor pets.,unknown
418,1173,what be -PRON- income requirement,incomeRequirement
419,1057,Do you accept applicants with felonies on their record?,feloniesPolicy
420,38,Hey! Thanks for reaching out. I won't be able to until next week,unknown
421,393,Just need to know prices for now,unitAssignment
422,1225,Do I need to make a deposit?,deposit
423,821,"If yes, how much is rent ? ",unitAssignment
424,533,Yeah can I schedule a tour please,tourBooking
425,1202,I'm wondering the prices for a efficiency or 1 bedroom,unitAssignment
426,1033,Can i have cigarettes in building,smoking
427,1226,"I am not in Houston, TX so virtual tour is better for me",virtualTour
428,886,"I'm looking for a 2BR, 2BA. Is there any available now?",unitAssignment
429,513,I'm looking to move in ASAP just needed to know like total move in price that I'll be looking at,moveInCost
430,1020,"Hi Ryan, thanks for reaching out.  I would like to schedule a tour. Any chance that tomorrow morning would work?",tourBooking
431,819,what cool amenity do -PRON- have,amenities
432,748,Can we do a tour Tuesday?,tourBooking
433,1111,Yes about your rent special,unknown
434,860,Ok just making sure cause I planned on paying online! An 3x the rent so that should be like 3000 a month then?,unknown
435,799,Start an app and I'm waiting for an approval response.,applicationProcess
436,470,"Perfect, thank you! ",unknown
437,833,Do you have any available?,unitAssignment
438,929,how much per month,unitAssignment
439,147,No washer and dryer connection.,laundry
440,1200,"Hi. Yeah, I just moved to Houston from California a few months ago. I'm just looking for a decent place I can afford on my own. I'm a student, so I'm finding out that it's difficult to study with roommates constantly making lots of noise. What is the lowest rental at Chestnut Hill?",unitAssignment
441,241,be there any application fee,applicationFee
442,375,I am looking for 2 bedrooms and will move by april 9,unitAssignment
443,190,Everything was wonderful!  What's my next step?  ,unknown
444,327,I am looking to move mid-may,unitAssignment
445,1348,"Okay, when will my application be reviewed",applicationProcess
446,1191,Today would be great for 11am,tourBooking
447,1149,The 6th would be perfect,unknown
448,511,Is subleasing allowed?,sublease
449,254,Hopefully I can remove they are in all your units,unknown
450,709,Is the electric included,unknown
451,538,can i bring in a dog,pet
452,336,what is the rent??,unitAssignment
453,508,what be full cost of move in,moveInCost
454,553,Do you have a parking area?,parking
455,757,Ok I will be willing to take a tour on Monday morning I will message tomorrow,tourBooking
456,499,what's the rent control policy?,rentIncrementPolicy
457,203,Im looking to move in on the 1st,unitAssignment
458,1230,Is there a way I can just fill out an online application,applicationProcess
459,995,how many pet can i have,pet
460,785,can I come this monday?,tourBooking
461,1137,Then with all the other money I get and help from my dad I'll be able to afford everything :),unknown
462,348,Ah. Thank you for reaching out. So I'm currently not based in SF and will be relocating next month. I have a colleague of mine who will check the apartment out on my behalf,tourBooking
463,341,Does this community feature a jacuzzi,hotTub
464,1088,Yes that does! What is the pet policy in place at your apartment?,pet
465,207,"would we be able to come tonight, around 5pm?",tourBooking
466,875,Do you accept Section 8?,section8
467,568,yes,unknown
468,248,On Wednesday,tourBooking
469,1026,I'm sorry imma try in come in today ,unknown
470,700,Unit options,unitAssignment
471,872,Do you have ceiling fans?,ceilingFans
472,414,What is the actual price monthly for the studio?,unitAssignment
473,484,Si,unknown
474,136,"I work for Ambit Energy and wanted to let you know about our customer referral program. Each resident you send to me that signs up for electricity service, our team can pay you $50 for each one!",unknown
475,849,If that's possible ,unknown
476,1372,What is the price for a two bed room apartment?,unitAssignment
477,1355,It will be me and my 3 kids which are all under 8 years old. I make around $5200 per month but looking for something around or under 1200 a month.,unitAssignment
478,898,"Ok, I can be there 4-4:15. Ok for you? Parking?",parking
479,0,5/14/2022 . & 2 beds,unitAssignment
480,892,what length of lease do -PRON- guy have,leasePeriod
481,396,I will let you know by the end of next week!,unknown
482,765,I thought y'all had other properties like you guys were connected?,unknown
483,292,I'm looking for 1 bed and 1 bath,unitAssignment
484,1049,Sure but you know we are moving in may at most,unknown
485,1150,Yo aplique ayer?,unknown
486,1354,What does the apartment include?,amenities
487,851,How much does utility cost by month,utilityBilling
488,1002,Would like a tour yes,tourBooking
489,689,Muchas gracias feliz tarde amigo !!,unknown
490,761,Are people with a broken lease history allowed,evictionPolicy
491,794,"Hi, sorry for the late response. I just seem that I'm not qualified, because my income is not enough.",unitAssignment
492,459,Do you have pool?,pool
493,978,Let go with Thursday at 6,tourBooking
494,362,Do you have a guest policy?,guestPolicy
495,1412,Do you have something cheaper unit,wantsLessExpensiveUnit
496,444,Maybe before that,unknown
497,1389,How much is the deposit again miss,deposit
498,383,I have no pets my income is like 2500 I believe and 5 occuppants,unknown
499,554,What time? When?,unknown
500,756,I'm sorry I don't have any pets. ,pet
501,30,do you allow cats,pet
502,582,Total Units in Building,total_units
503,1050,Anytime tomorrow is fine,tourBooking
504,86,Just want to follow up if he is waiitng for me,unknown
505,199,can i come for tour?,tourBooking
506,1282,Is that close to Sugarland?,nearbyAttractions
507,337,What is the pet pololicy,pet
508,989,2 bedrooms and I'm looking to move April 9,unitAssignment
509,963,2 bedrooms are $850,unitAssignment
510,607,Additional information,unknown
511,783,"3b-2b, & sometime in may",tourBooking
512,255,I just want to know if I can park in that space while waiting for my apt,parking
513,1134,We are looking for a 3 bedroom and 2 bathrooms and want to move by June or July.,unitAssignment
514,473,hear*,unknown
515,287,What lease length options are offered? (please specify),leasePeriod
516,1450,"I am not interested, thank you",notInterested
517,127,I need to reschedule OR I need to change my time,rescheduleTour
518,1000,be there any condition because of which -PRON- will with hold the deposit,withholdDeposit
519,1071,You have any available now,unknown
520,108,"Hi Kelsey, that was a while ago, I already found a place, thanks though!",unknown
521,1209,What info do I need to fill out application for 1bedroom,applicationProcess
522,366,What type of tour options do you provide?,tourOptions
523,252,Will do.  Thanks!,unknown
524,55,i was also seeing if water/ electricity are included,utility
525,1333,Would it be possible to come see it tomorrow and  possibly apply?,applicationProcess
526,353,"Is there a guest policy? Please describe. Additionally, if you have a guest policy posted online, please paste the link here.",guestPolicy
527,1161,Thank you so much,unknown
528,629,Do you have any availability on Sunday?,leaseGaurantor
529,571,Does the property offer a private bathroom and bedroom ?,amenities
530,937,under what condition will -PRON- with hold the deposit,withholdDeposit
531,962,2,unknown
532,1323,I need to know what your move in requirements  are.,applicationProcess
533,521,What are the amenities? Is there a washer dryer in unit?,amenities
534,321,I have a application I will bring it tomorrow at 12:00,applicationProcess
535,1235,I do also have a dog who is an Australian shepherd. He is 45 lbs so I wanted to check if he was too big to be allowed,pet
536,865,Yeah I have a felony of 8 years back agg robbery in was wondering if this could stop me from moving into your establishment,misdemeanorPolicy
537,854,"1 is fine. I'll rearrange some things, thanks!",tourBooking
538,884,"Yes, please tomorrow 3pm is good for me",tourBooking
539,124,Hi! Yes pets are allowed,pet
540,1197,"Hi, I will not be able to arrive at the agreed time. I'm in a meeting and I don't know what time it ends.",unknown
541,1126,Is the apartment furnished?,furnishedUnit
542,8,how long of lease do -PRON- offer,leasePeriod
543,172,I'm not looking for a rental anymore. Please close this out. Thanks!,unknown
544,1083,How much for a one bedroom?,unitAssignment
545,1414,Need some cheaper,wantsLessExpensiveUnit
546,346,monthly cost for the place,unitAssignment
547,695,Ya que no hay forma de comunicarme cn ustedes y no estoy recibiendo la respuesta que espero,unknown
548,369,600-800 move in date April 5 1 and 1 pet,unitAssignment
549,238,Or 6 month lease,leasePeriod
550,235,How much is the rent?,unitAssignment
551,893,are the units Furnished in the building,furnishedUnit
552,311,how much be the rent,unitAssignment
553,68,"Yes,A 1BdrmOr Studio, However, Do You Accept Section 8?&Is It Possible To Prorate The Security Deposit In Addition To Rent Payment Until The Security Deposit Amount Is Paid In Full? Also How Is Rent For Apts There,& Security Deposit?",section8
554,1334,Price for 1bedroom,unitAssignment
555,1236,Based on my travel (driving from Alaska) and schedule it is nearly impossible to do most of this in person.,virtualTour
556,1420,I want to reschedule my tour,tourReschedule
557,536,Hi Ryan! Thanks for a prompt repsonse. I would like to schedule a tour. Do you have any availability on the upcoming friday?,tourBooking
558,1158,im looking for 1 bed and 1 bath,unitAssignment
559,240,"Are furnished units available? If yes, what furnishings are included?",furnishedUnit
560,1206,hello your location is in dallas tx?,community_address
561,817,Im looking for 1 bed and 1 bath,unitAssignment
562,212,do you have 2 bedroom avablity,unitAssignment
563,777,???,unknown
564,194,Got a bridge between please don't give up on me I will be pulling out the application today thank you so much for continue to check on me I would like to try to get approved and moved in maybe the 30th or 31st,unknown
565,11,To send a rental verification,applicationProcess
566,949,Hi there! Waiting to hear back from my friend regards getting a place. I was actually helping her to find one. Let you know. Thank you!,unknown
567,403,I'll keep looking thanks so much,unknown
568,1289,"Hi. Yeah, I just moved to Houston from California a few months ago. I'm just looking for a decent place I can afford on my own. I'm a student, so I'm finding out that it's difficult to study with roommates constantly making lots of noise. What is the lowest rental at Chestnut Hill?",unitAssignment
569,178,Townhome ?,unknown
570,970,Tienen apartamentos disponibles de 2 recámaras,unknown
571,492,Yes I would. I think I did a virtual tour,virtualTour
572,770,Thank u I have my appt with him tomarrow I hope he gets the voicemail I cant get there until 3 30 instead of noon time thanks again,tourBooking
573,810,"I'm sorry,looking for all bills paid for now thanks for your help ",utilityBilling
574,442,Do you have a pet deposit/rent?,petRent
575,157,when can i come to see the place,tourBooking
576,1234,Do you take section 8 vouchers,section8
577,798,Cool,unknown
578,1103,I'm trying but I cannt log in,unknown
579,815,Do you have swimming pool?,pool
580,1415,Do you have anything else,wantsLessExpensiveUnit
581,188,It's going to cost me a lot to get out of my apt in south baby,moveInCost
582,786,Yes I would love to.,unknown
583,1451,Hello I'm not interested in the apartment I've already found one and actually the one I wanted I greatly appreciate you reaching out have a nice day 😊,notInterested
584,146,2 beds on or before 03/31,unknown
585,622,is there any restriction on pets,pet
586,357,I'll see if I can go tomorrow aftrr work ,tourBooking
587,164,"Thank you, you too! ",unknown
588,1208,Yes what's the address,community_address
589,1109,"I donnt need the tour any way, can I apply for the apartment",unitAssignment
590,1238,what's your parking policy,parking
591,704,I will be there,unknown
592,883,Is there any outer space,outerSpace
593,1394,Do you have a move in special ?,leasingOfficePromotion
594,1363,Yes do this unit have any garage,amenities
595,740,how about a gym,gym
596,939,yes thatll work,unknown
597,725,"Are there parks, restaurants, clubs in the neighborhood",nearbyAttractions
598,1265,"Hi, we are interested in a 3 bedroom apt downstairs. Can you tell me a bit more on what the deposit is and what are the fees?",deposit
599,389,can i book a tour with -PRON-,tourBooking
600,76,"I am still looking, what are the prices for 2 and 3 bedrooms?",unitAssignment
601,806,I want to cancel my tour,tourCancellation
602,546,"Take me off your 
Contact list",unknown
603,16,Yes that's fine.. February! 1 bed/ 1bath. No children nor pets.,unitAssignment
604,660,"Is there a fitness facility? If yes, what equipment is available?",gym
605,684,Do I need to have a good credit history?,creditScore
606,1022,What is the minimum income requirement,incomeRequirement
607,1029,Yes and the deposit and fees you will need to pay before moving in,moveInCost
608,1157,I would love to schedule a tour. What time would be best?,tourBooking
609,6,I did a tour yesterday already.  I will reach out to the leasing office then for further info. thanks,unknown
610,1335,What all comes with it ?,amenities
611,139,how do i get there,community_address
612,385,Because the other units are in soma area,nearbyAttractions
613,1125,Does your community provide accomodations for the handicapped? Please describe ADA,handicapPolicy
614,908,"Yes, I was wondering what are you guys 2 bed rooms releasing for ?",unitAssignment
615,1440,Hello. This is Woohyun. I think I'm going to have to cancel this appointment because I decided to go somewhere else this morning. I'm very sorry.,tourCancelled
616,1324,I'm sorry where is this property located?,community_address
617,441,Okay an whats the difference between the one thats $720 & the $908,unitAssignment
618,994,"Hi Ryan, I'd be interested to get a virtual tour if possible first and more details about building before coming in for a tour",virtualTour
619,1360,I'm not able to come to houston but I would love to know if y'all go short term leases. I am only staying in town for the summer,leasePeriod
620,626,"Yes j wanted to see pics of the 2 and 3 bedroom,",unitAssignment
621,507,unit 2 is good for me,unitAssignment
622,1255,Do you offer virtual tours as I am moving from out of state and cannot come visit in person as of this point in time,virtualTour
623,584,do i need good credit,incomeRequirement
624,490,hey,unknown
625,703,Yes I was wondering how's the parking like,parking
626,128,1 bedroom is fine however if two bedrooms 2 bath are available I want to look at those as well and by april8th if that's too soon then by the end of April no later than,unitAssignment
627,125,One bed for now. Move in date may or June,unitAssignment
628,658,3bed 2bath its looking good for me,unitAssignment
629,430,Do you offer virtual tours,virtualTour
630,1436,"Actually,  I would like to cancel the tour, thank you. ",tourCancelled
631,1139,9 am works for me,tourBooking
632,1040,be there a four wheeler parking,parking
633,1056,Can you call me tomorrow,unknown
634,73,"i can't call right now, but the best day for me to schedule a tour would be monday march 1st. or a virtual tour",virtualTour
635,772,Let me get back to you on that!,unknown
636,714,Hello 2300 is to much for me thank you though I am willing to go 2000 if you find anything,unitAssignment
637,1104,What is your eviction policy?,evictionPolicy
638,848,what utility be offer in rent,utility
639,717,"I will, thank you!",unknown
640,925,"Hello, currently not at this time but I will be looking very soon. Thank you very much !",unknown
641,63,What furniture is included,furnishedUnit
642,897,I want to stop by today,tourBooking
643,1244,How much is your one bed,unitAssignment
644,222,i want to schedule a tour,tourBooking
645,1369,what's the application fee and admin fee,applicationFee
646,267,I'm looking for a 1 bed 1 bath apartment for the start of may,unitAssignment
647,1396,I'm looking to move in ASAP just needed to know like total move in price that I'll be looking at,moveInCost
648,1269,I would like to know additional information. I am looking to move in June 1st (or the first week of June). I would like to schedule a video tour if that is possible.,virtualTour
649,100,Do y'all do virtual tours? ,virtualTour
650,1248,How much is the deposit,deposit
651,816,Ok,unknown
652,59,Are there 1 bedrooms,unitAssignment
653,1052,Is the property in HISD?,community_address
654,350,What are the parking options at the community?,parking
655,1224,Is the application fee refundable,applicationFee
656,349,I can come then,unknown
657,1038,"Hi! I would like to prematurely schedule a virtual tour. I'm living in Covington, Kentucky right now but have job prospects in San Francisco.",virtualTour
658,61,What places are accessible around the property,nearbyAttractions
659,524,How do i get to the lease office,leaseOfficeDirection
660,179,What is the address of the leasing office?,leaseOfficeDirection
661,425,What is the address of the community?,community_address
662,428,Hola,unknown
663,113,There's was no price on these two what are the prices,unitAssignment
664,1063,Whats app fee and deposit,applicationFee
665,228,I dont recall asking about an apartment,unknown
666,224,Im out of town working but im relocating in Houston an im looking for an nice quiet area. I would like to know the pricings for 1 bedroom & if they were updated,unitAssignment
667,687,second looks fine to me,unitAssignment
668,850,Show much is move in?,unknown
669,313,I'm looking for 1 or 2 bed apartment,unitAssignment
670,1452,I'm not interested. Thank you. ,notInterested
671,654,"Great, when can we set one up? And can you tell me a little more about the units you have available please and the application process?",applicationProcess
672,452,Been working with John and Gustavo,unknown
673,818,Is there a central Air conditioners in the community?,airConditioner
674,115,I'd love to come take a look at the property today what time you'll be in till,tourBooking
675,1025,On 1st floor,unknown
676,1341,Can you send me the address,community_address
677,411,How often will rent be increased?,rentIncrementPolicy
678,475,Okay sounds good,unknown
679,1327,I am going to be moving to the area within the next month I would like to see what is you guys price range,unitAssignment
680,903,What's the rent increment policy,rentIncrementPolicy
681,392,Ok,unknown
682,1148,Any openings for July as for a move in date ? If so we'd be more then happy to apply for the 1bed,unitAssignment
683,576,do -PRON- require renter insurance,renterInsurance
684,1217,OK thanks what is your website,propertyWebsiteLink
685,1223,Is there a move in deposit fee,deposit
686,253,I got a quote already,unknown
687,713,Do yall have any move in specials,unknown
688,93,Where are you located at,community_address
689,1100,"Hey Ryan! I hope you are as well! 
Yes I'd like to schedule a tour. I was wondering also the availability of a 3 bed room - is that something you have?",tourBooking
690,230,I'm sorry I'm going to look at the list again and let you know which one I decide to tour.,tourBooking
691,1155,Yes I was inquiring about your 2 bedrooms how much are they ? & is there any available,unitAssignment
692,1252,Hi do you guys have any move in specials at the moment,leasingOfficePromotion
693,596,be sublease allow,sublease
694,406,Hey im interested  in the property,tourBooking
695,940,And is it refundable if not approved? Or applied to rent if approved. Any move in specials?,unknown
696,291,can i come for a tour,tourBooking
697,1256,The email I have says $45 app fee and $100 admin fee? Which is it?,applicationFee
698,1326,Yes prices and any move in ready 3+ available by the 1st,unitAssignment
699,219,okay thanks,unknown
700,1015,Yes. I got one.Thanks.,unknown
701,1253,"Hello I was wondering, how much is the rent there? For two bedrooms",unitAssignment
702,1376,Yes so I’m looking to possibly relocate however I’m wanting to know about the move in special you guys have I currently live in Monroe Louisiana,leasingOfficePromotion
703,1192,Ok how about the one bedroom prices,unitAssignment
704,367,What holidays do you observe during which your leasing offices will be closed or have special hours?,leasingOfficeHolidays
705,1064,tell price,unitAssignment
706,1054,"Thank so much,I'm available Tuesday at 6:45pm",tourBooking
707,26,Someone already reached out to me about that place from sf rent,unknown
708,1408,"Hi Kelsey, I submitted a request for a virtual tour of A2 floor plan on this weekend. Could you please help me confirm the request? Thank you so much",virtualTour
709,1437,"Hi, good morning I have to cancel the tour  y let you know on these week what day I can go sorry.",tourCancelled
710,804,do you have 2x1 bedroom avablity,unitAssignment
711,1093,Does the AC reach every room,airConditioner
712,272,Hello I'm looking at your website and it's not showing any 2/2 for may or price's how much are your 2/2 and when will it be available?,unitAssignment
713,1403,How much are your 1 bed rooms going for,unitAssignment
714,223,Thursday 6 is good 👍,unknown
715,1177,how many parking spot do -PRON- come with,parking
716,485,The day is fine for me can we schedule the tour and you can help me to fill up the application I try to but I am missing some spots,tourBooking
717,1166,Do you have any times on Friday?,tourBooking
718,1130,how much do -PRON- cost to apply,applicationFee
719,826,How many pets are allowed,pet
720,421,Or 2bed/1bath is ok as well,unitAssignment
721,528,What is the rent for the 1 bedroom and location?,unitAssignment
722,141,can i lease on a month to month basis,leasePeriod
723,665,Parking,parking
724,1435,I have to cancel my family needs me today,tourCancelled
725,1291,what utilities if any are included in the rent?,utility
726,407,"Thank you, when we get to the place will this person be there?",unknown
727,514,What is your rent payment policy?,rentPaymentPolicy
728,1365,yes do this unit have any garage,amenities
729,1120,be there a gym available,gym
730,1152,2 bed 2 bath looking good for me,unitAssignment
731,981,hi,unknown
732,189,what be -PRON- condition to withhold the deposit,withholdDeposit
733,221,What is the walk score,nearbyAttractions
734,853,No 2 bedroom?,unitAssignment
735,1220,"Hey Kelsey, Can You Tell Me What's The Process With Leasing ?",applicationProcess
736,486,Do you guys have a website?,propertyWebsiteLink
737,673,Is credit check required,creditScore
738,732,No not moving now. Lost job. But thank you for checking.,unknown
739,1247,I currently stay in Irving but I am relocating down to that area. Would credit or background be an issue?,creditScore
