,Unnamed: 0,utterance,expected
740,932,Is it going to cost extra for pets,petRent
741,778,can -PRON- tell -PRON- more about the gym in premise,gym
742,696,could you send me the rent cost?,unitAssignment
743,1330,Is there a virtual tour possibility.,virtualTour
744,316,How do i measure a good credit record,creditScore
745,273,I want to know more the unit?,unitAssignment
746,964,how much be -PRON- to apply,applicationFee
747,728,"Ryan , Thank you for showing the room for me ...I will call again soon  ...",unknown
748,483,No answer,unknown
749,464,do you have health club,gym
750,1331,Is there a website for this location I can check out pictures ?,propertyWebsite
751,640,What is leasing office direction,leaseOfficeDirection
752,317,I can't make my tour OR I need to cancel OR I won't be able to make it OR Please cancel my tour OR I can't make my tour,tourCancellation
753,1304,What does your credit score have to be?,creditScore
754,4,I will get in touch with you next week.,unknown
755,205,I want the space,parking
756,1131,Hey Kelsey Good Morning this is Covia so just wondering how much is your application fee?,applicationFee
757,98,what be the total move in cost,moveInCost
758,1374,The deposit and the application fee,applicationFee
759,1123,What is the property website,propertyWebsiteLink
760,549,We are flexible. But looking for a 2-3 bedroom place.,unitAssignment
761,374,is there wheelchair access?,handicapPolicy
762,450,How much is the deposit again miss,deposit
763,1147,Yes,unknown
764,482,uinit 1 looks for good for me,unitAssignment
765,656,What tour types do you offer?,tourOptions
766,515,Are there any extra utility charges,utilityBilling
767,808,Where is the property,community_address
768,1045,Yes! A tour would be great. Do you have any availabilities  the week of April 5-11?,tourBooking
769,862,"I know lower nob hill is a little pricier, but I would be okay with a studio within that price range there. Do you have any listings there?",unitAssignment
770,1167,2 Bed 2 Bath Preferably April 6th,unitAssignment
771,881,do you have gymnasium,gym
772,1107,"And is this promotion still valid

I sent you an email about it . : $ 2500 REIMBURSEMENT FOR MOVE IN / FURNITURE COST AND NO APPLICATION FEE
Exclusions may",unitAssignment
773,1219,What is the website,propertyWebsiteLink
774,1344,What is the starting rate for deposit??,deposit
775,1021,Do the apartments have ceiling fans?,ceilingFans
776,1336,Can it be earlier,rescheduleTour
777,22,Yes i would love to schedule a tour,tourBooking
778,202,Does this community feature air conditioning?,airConditioner
779,60,I'm sorry. I was working. ,unknown
780,957,Do you have any specials,leasingOfficePromotion
781,1340,Is it possible to do a virtual tour? I am currently in Chicago and won't be in Texas until the moving in date,virtualTour
782,1058,We are applying now,unknown
783,64,can you prvide tomorrow's slot for visit?,tourBooking
784,122,Are all bills paid,unknown
785,620,Hey yes,unknown
786,712,I am looking for 2 beds and 2 baths,unitAssignment
787,968,reschedule my tour,rescheduleTour
788,836,be park available,parking
789,857,Yes I am looking for a 2 bd,unitAssignment
790,769,I'm available today or Friday afternoon or any time next weekend,tourBooking
791,1128,"Hi Ryan , what is the price on this place?",unitAssignment
792,176,jdfbdkjdk,unknown
793,976,Yes the 1bed 1bath is perfect and do u have any openings next week/weekend,unitAssignment
794,66,what be the rent,unitAssignment
795,391,What is the name of the apartment?,community_name
796,1212,Application please,applicationProcess
797,589,How much are your 1 bed rooms going for,unitAssignment
798,174,"Are lease guarantors allowed? If yes, what are your policies/requirements for lease guarantors?",leaseGaurantor
799,303,"Hi, my job temporarily shut down till Tuesday for some maintenance, any availability for a tour before then starting tomorrow ?",tourBooking
800,1424,I won't be able to reach for tour,tourCancelled
801,1085,Let me check it out and I'll let you know,unknown
802,1292,Do you accept HUD Housing Vocher,section8
803,217,Just making sure that the property is $1425 a month?,unitAssignment
804,866,One bedroom 1 bath. May 6,unitAssignment
805,1003,Price on the two bedroom ?,unitAssignment
806,639,"We can do tomorrow 5:30-6:30. Sorry I keep missing your calls. I'm at work. Should I text, call or just show up at that time?",tourBooking
807,1180,The payment for parking is separate?,unitAssignment
808,150,I can't tomorrow I was wondering if you have any available for next Friday,tourBooking
809,767,Yes ma'am I wanted price and information on a 22 or 21 available May 1 deposit application fees and requirements to get into apartment thank you so much,unitAssignment
810,678,Thanks so much,unknown
811,691,What is your website,propertyWebsiteLink
812,101,Saturday 10:00am,unknown
813,517,"Hi Kelsey, I called you a few minutes ago, and we agreed to call again on 29th of march",unknown
814,289,sorry but is this studio for 3 people?,unitAssignment
815,1433,Sorry for the inconvenience you can cancel my appointment for Monday I came by there Friday afternoon. The street in front of the apartments stay busy,tourCancelled
816,914,"Hi Ryan, to thanks for texting me. Yeah, I'd like to schedule a tour and see the place, I'm available on weekends. Let me know a good time for you.",tourBooking
817,902,We have selected another property thank you for your time,unknown
818,279,I would like to!,unknown
819,1135,could i schedule a viewing,tourBooking
820,1145,do be have in unit laundry,laundry
821,1257,Hi! Is a zoom tour available?,virtualTour
822,138,Under what circumstances will a tenant's deposit be held at termination of tenancy?,withholdDeposit
823,458,I'm getting ready to go back into work now I would like to talk to you at some point,tourBooking
824,1260,Yes. Do you offer virtual tours?,virtualTour
825,276,Do you have one bedroom apartment available,unitAssignment
826,543,Let me get back to you. Ur address is not directly on public transportation. So am i trying to find something on it.,unknown
827,951,"Hello I was wondering, how much is the rent there? For two bedrooms ",unitAssignment
828,971,I will want to move ASAP,unitAssignment
829,9,Says street parking only,parking
830,278,"Yes, I would like to schedule a tour",tourBooking
831,1146,Do you have studio or any 1 bedroom apartments available anywhere else in the city? Like the mission or elsewhere?,nearbyAttractions
832,322,I can do a virtual tour if available as I am moving from California and will be in Houston Wednesday March 30th. Will you have a 2bed/2bath available?,unitAssignment
833,330,can i smoke,smoking
834,42,Hey does Saturday still work?,tourBooking
835,245,Yes I would like a tour.,tourBooking
836,99,Will do!,unknown
837,1346,Hi I completed my application,applicationProcess
838,1342,"I'm not there yet
I have a black lab 
Dogs ok?",pet
839,258,thank you,unknown
840,1364,yes do this unit have any garage,amenities
841,315,be subleasing allow,sublease
842,1358,Okay do you guys have any credit requirements,creditScore
843,1151,"Do you accept applicants with misdemeanors on their record? If there are any details regarding felonies/misdemeanors, please add them here.",misdemeanorPolicy
844,1375,How much is your one bed,unitAssignment
845,161,Do i have to have a job,incomeRequirement
846,734,1 or 2 bedroom,unitAssignment
847,1388,"Goodmorning, Yes I would love a tour but I'm moving from Norfolk va to Houston is their any way possible that I could do a virtual tour?",virtualTour
848,226,be renter 's insurance require,renterInsurance
849,846,I was looking for a all bills paid apartment but it really didn't say if it is or not,unknown
850,1454,I was interested in the $2119 apartment,wantsLessExpensiveUnit
851,1181,do you have 2/1 availability,unitAssignment
852,1010,1bedroom,unitAssignment
853,1445,"Yes, that will work. If I have to reschedule, I will let you know (must check with my sitter, but there's usually no issue). Thank you! Btw, my legal name is Candace Abigail Smith, if you want that for your records.",tourReschedule
854,399,"Hello! I work until 5, but I'm off Wednesday at 1. Any availability Wednesday afternoon?",unitAssignment
855,895,"Oh, okay",unknown
856,453,"Thank you so much
Good night ",unknown
857,1419,I want to know more the unit?,wantsLessExpensiveUnit
858,479,do -PRON- allow pet in the apartment,pet
859,625,What is the link to the community's website?,propertyWebsiteLink
860,830,I will like to,unknown
861,950,"Hi, I believe I already sent in my application and was told it is being processed",applicationProcess
862,1214,How much for I bed room 1bath,unitAssignment
863,356,What is the minimum credit score requirement?,creditScore
864,960,Y cuanto debo pagar d renta?,unknown
865,647,what type of lease do -PRON- offer,leasePeriod
866,1233,do you have a pool,pool
867,591,what is your  misdemeanor policy,misdemeanorPolicy
868,1418,Shell I have few more option to select,wantsLessExpensiveUnit
869,1447,"Hi Kelsey, I'm sorry but I am not interested anymore thank you",notInterested
870,262,tell rent,unitAssignment
871,1273,Do you have virtual tours,virtualTour
872,840,what be the rent and when can i move,unitAssignment
873,355,Good morning. Yes I am still interested,unknown
874,145,"Obviously you didn't list any for Monday, but in case anything opens up please feel free to notify me",unitAssignment
875,675,Can I come tommorow around 1030 please,tourBooking
876,974,Is there anyway to see the property without visiting it,virtualTour
877,478,Prices,unitAssignment
878,1196,Really a studio  or 1 bed,amenities
879,747,Do you have a swimming pool,pool
880,1082,"Hi Divyai, this is Kelsey. I'm following up since you recently inquired about Cantera. Do you have any questions or can I assist you with scheduling a tour?",tourBooking
881,870,Yes ma'am would Friday at 3 work ?do y'all have a washer and dryer included!,utility
882,512,"budget would be 1400h or $1500, move in date is 04/28/22, number of occupants is 3 an adult and 2 babies, and I need 3 bedrooms and 2 baths",unitAssignment
883,1305,Is this a virtual tour ?,virtualTour
884,90,I want to but I have an eviction and I was told I can't apply or I will be denied,evictionPolicy
885,1042,Okay sure a virtual tour,virtualTour
886,10,Can i throw dinners or parties,guestPolicy
887,811,Do you allow dogs?,pet
888,420,do -PRON- need renter insurance,renterInsurance
889,873,what all things are there in outer space,outerSpace
890,1074,Removed a question mark from “I've scheduled you for 6 PM viewing on Tuesday 02/23/21. See you there! Take care.”,unknown
891,97,do the landlord pay for water,utility
892,698,I'm actually getting ready for work,unknown
893,858,Schedule a tour.,virtualTour
894,1006,I am looking for a one bed one bath and my lease is up in May so sometime either before or in the beginning of may,unitAssignment
895,413,What Studios do you have available in the mission district?,unitAssignment
896,305,I just booked it actually!,tourBooking
897,296,Good morning I do my application a couple of days ago trying to see is my status,unknown
898,843,I need to know how much the studios go for?,unitAssignment
899,604,Can i see the property video on whatsapp,virtualTour
900,944,Cancel only,tourCancellation
901,131,Wrong number,unknown
902,969,"Hi Ryan, sorry I need to reschedule the tour, would it be possible tomorrow morning?",tourBooking
903,466,price for the property,unitAssignment
904,530,"Hello Kelsey!  My apologies been such a busy week.  I actually scheduled a tour via email for Saturday (reply via sfrent.net)

I found the listing via hotpads.  Should I just have scheduled with you instead?",unknown
905,446,Hi Kelsey! Sure! What time?,tourBooking
906,1001,No something came up I have to take care of it,unknown
907,1316,When is the best day and time for tour? Do I have to do application online or in office?,applicationProcess
908,454,Will be available tomorrow morning 10am. Thank you for your response,tourBooking
909,592,feedback survey. Please inform the office before lease signing.,unknown
910,1250,"hi , yes virtually",virtualTour
911,400,Can I park in that space while viewing,parking
912,123,pets ?,pet
913,47,How much do call the 2 bed 1bath,unitAssignment
914,440,What's the security deposit amount?,deposit
915,183,No,unknown
916,705,Are guest allowed ?,guestPolicy
917,288,https://www.zumper.com/apartment-buildings/p268509/635-ellis-tenderloin-san-francisco-ca,propertyWebsiteLink
918,206,be there a parking space,parking
919,36,What holidays does your leasing office observe and how does that affect their hours?,leasingOfficeHolidays
920,606,can the application fee be waived,applicationFee
921,265,i have a pet be that alright,pet
922,1279,Is a bit too early. I have to sell my house in Jersey. I don't know if I should buy or rent.,unitAssignment
923,1245,Yes so Iâ€™m looking to possibly relocate however Iâ€™m wanting to know about the move in special you guys have I currently live in Monroe Louisiana,leasingOfficePromotion
924,745,"And yes pls, I will like to see available 2bed 2baths you have in advance.  Thanks",tourBooking
925,160,Is the 2/13 in person or can I do it via a video call with an agent?,tourOptions
926,1288,No I work do you guys do virtual tours,virtualTour
927,598,"Is it possible to have a virtual tour? I live in Baton Rouge, LA, which is 5h away.",virtualTour
928,1347,I have completed my application and paid online,applicationProcess
929,771,Are there coolers in the apartment,airConditioner
930,579,what is the cost to apply,applicationFee
931,1096,Will do. I got your email and will get something scheduled. Thanks!,tourBooking
932,1329,Yes is there a website ?,propertyWebsite
933,550,Hi Kelsey- no further information is needed at this time. I appreciate the follow-up!,unknown
934,325,Sure. Budget of around. 700-800-900$ & only 1.,unitAssignment
935,774,"Hello Ryan 
Let me check and I will let you know 
Thanks ",unknown
936,52,I just started new job and in Sunnyvale I am there Saturday and Monday 11-3,unknown
937,495,"Yes, I submitted the application about 3 minutes ago",applicationProcess
938,1024,I don't have any pets,pet
939,213,I don t need tour,unknown
940,664,Yes,unknown
941,630,Or can you let me know when you have time Wednesday night and after. I'm currently mini vacationing with my son until work Wednesday?,leasingOfficeHoursWednesday
942,796,No I am not moving until late fall. Thanks you,unitAssignment
943,837,I work in South Bay,unknown
944,323,Okay perfect!! Thank You,unknown
945,534,What are your leasing office hours on Saturday?,leasingOfficeHoursSaturday
946,166,How to locate the property,community_address
947,35,What are your leasing office hours on Wednesday?,leasingOfficeHoursWednesday
948,575,that sounds good,unknown
949,1296,How much is it to move in,unitAssignment
950,1281,cancel my tour,tourCancellation
951,434,This place must be very nice,amenities
952,1046,do you have a swimming place,pool
953,494,Will you be able to do a virtual tour?,virtualTour
954,142,I need this studio🥺,unitAssignment
955,841,Do you work with felonies?,feloniesPolicy
956,500,Yes I will be coming today,tourBooking
957,980,Do you have any virtual tours available?,virtualTour
958,308,"Hi Ryan, yes I would like to schedule a tour but could we do Thursday instead? Thank you for getting back to me",tourBooking
959,351,Testing again,unknown
960,896,Yes how many one bedroom do you have available and if I'm approved how soon would I be able to move I ,unitAssignment
961,1429,"That is above his budget, but thanks for letting me know",wantsLessExpensiveUnit
962,911,Is pets allowed?,pet
963,344,1 bedroom newly renovated and may 12,unitAssignment
964,1425,Can you cancel my tour,tourCancelled
965,556,anything under 5000 $,unitAssignment
966,309,Yes when I just called they said they are not doing tours,tourBooking
967,504,Do i need a backer,leaseGaurantor
968,615,"Awesome, this is a great space and am really interested. What is the application process and how can I start?",applicationProcess
969,735,Monday works great,tourBooking
970,736,"Yes, please tomorrow 2pm is good for me",tourBooking
971,251,That doesn't work. I get off work at 6,unknown
972,1133,what be the price,unitAssignment
973,332,Questioned “I've scheduled you for 6 PM viewing on Tuesday 02/23/21. See you there! Take care.”,unknown
974,225,Hi there. Yes I will be there at 4pm for my tour today. Thank you,tourBooking
975,787,Utility billing,utilityBilling
976,662,I have all the required documentation,unknown
977,773,Sunday works for me,tourBooking
978,1102,No thank you,unknown
979,541,be renter insurance mandatory,renterInsurance
980,386,Does the rent increase over time?,rentIncrementPolicy
981,1,Yes I would like to schedule a tour,tourBooking
982,502,How*,unknown
983,754,monthly rental,unitAssignment
984,480,can i visit this monday?,tourBooking
985,702,Do you have swimming pool,pool
986,382,Can i have my family or friends over,guestPolicy
987,126,What utilities are included in the rent?,utility
988,218,Hey yes I'm interested in the apartment ,unitAssignment
989,784,what utility,utility
990,917,what are all the utilities included,utility
991,1278,Yes i was wondering if you accepted college students with no credit history but had the income for the apartment ?,creditScore
992,451,I have time tomorrow and Wednesday-,tourBooking
993,215,1 bed one bath,unitAssignment
994,947,can i come in for a tour later today,tourBooking
995,489,Yes please what are all your qualifications to move in how much is your deposit admin fee and application,applicationFee
996,1407,"Hi Kelsey, I submitted a request for a virtual tour of A2 floor plan on this weekend. Could you please help me confirm the request? Thank you so much",virtualTour
997,376,Yes,unknown
998,594,is the deposit negotiable?,deposit
999,429,"Hi, yes can i have more info. ",unknown
1000,552,Yea i would like to!,unknown
1001,1162,Can they open up for 10 minutes I can't do any of these,tourBooking
1002,334,And yes I am interested,unknown
1003,14,346 299 8324,unknown
1004,1153,do -PRON- come with utility,utility
1005,1068,Works the best,unknown
1006,71,Yes I am,unknown
1007,661,"Questioned “Hi Tandra, this is Kelsey reaching out because I saw you submitted an inquiry for Stratford House Apartments. Would you like to schedule a tour or know any additional information?”",unknown
1008,231,Yeah that would be fine :),unknown
1009,1382,"Hi yes I was wanting to more information about the unit. How much does a 2 bed cost, and what is the deposit and application fee ?",applicationFee
1010,244,looking for where close to the city,nearbyAttractions
1011,387,I will let my friend know and see what she says. Thank you!,unknown
1012,1455,"Hello sorry, I'm still looking at apartments, I didn't realize I accidentally submitted something.",unitAssignment
1013,525,what amenity do this unit have,amenities
1014,415,"Hi Kelsey,
Ryan actually scheduled me for the open house tour @3:30 tomorrow.
I do appreciate your out reach.
Thanks so much,
Jayson",unknown
1015,445,Is there a fan in every bedroom,ceilingFans
1016,144,Thank you so much and you have a great day as well,unknown
1017,727,How many apartments are there in this building?,total_units
1018,1163,I like the 2x1 but i wanna look at the 1x1 too,unitAssignment
1019,12,I think you have the wrong number,unknown
1020,1332,"1 person, 2 pets, maximum for rent is what I found listed on apartment list for that apartment which is 960 a month",unitAssignment
1021,39,May1,unknown
1022,1302,I unfortunately can not do a in person tour because I currently live in Ohio I am in the process of moving to texas I did want to know some information,virtualTour
1023,54,What property,unknown
1024,19,"Hello, thank you. What is the location of the 1 bedroom apartment?",community_address
1025,555,Unavailable,unknown
1026,1409,Can you please show me some cheaper unit,wantsLessExpensiveUnit
1027,688,is there on street parking available for guests,parking
1028,781,Im having a hard time finding a place for me and my kids to live,unknown
1029,297,swimming pool,pool
1030,904,Did you rent out #5 yet?..its been posted off the market,tourBooking
1031,496,What is the process for application submission ?,applicationProcess
1032,469,"meaning in great shape, breath able",unknown
1033,472,1 bed 1 bath. Within 2nd week of April.,unitAssignment
1034,1367,I have a question about background. I have a class D misdemeanor assault charge that is 7 years old. No previous record and no record ever after. I am educated and I am a teacher. I want to disclose this information and see your leasing company policy prior to visiting and starting the application and deposit process. I can provide any other information to you or management in regards to this issue.,misdemeanorPolicy
1035,828,what is your felony policy,feloniesPolicy
1036,941,"Hi Ryan, thanks for reaching out. Not quite yet but I'm considering. 

I wanted to ask where the bathrooms and showers are, also the cost of the rent and deposit. Do you allow students to stay at your apartments?",unknown
1037,418,Friday works! I'm a chef so work early morning at 6 till 2:30 so Friday works!,tourBooking
1038,632,Ok,unknown
1039,419,I need to move in as soon as possible,unitAssignment
1040,298,What amenities do you offer at the property?,amenities
1041,531,are there any charges for having a pet,petRent
1042,427,I tried to come before 3pm today.,unknown
1043,91,Thank you,unknown
1044,103,Where are the apartments located ?,community_address
1045,185,Thanks,unknown
1046,129,Yes I've scheduled a tour for tomorrow,tourBooking
1047,1106,Thank you. Cam you please explain what the “move in/furniture cost reimbursement “ means?,unknown
1048,163,Is utility more expensive during the winter,utilityBilling
1049,340,Hi! Thanks for reaching out!,unknown
1050,1287,How much for a 1bedroom 1 bath,unitAssignment
1051,548,What is the price for a studio,unitAssignment
1052,455,Hi - not interested - thanks,unknown
1053,871,Is mornings available,unknown
1054,214,When can i make a visit,tourBooking
1055,370,I would love to schedule an tour,tourBooking
1056,603,Yea I'm here,unknown
1057,197,do -PRON- allow sublease,sublease
1058,1387,pet?,pet
1059,820,unit 2 works for me,unitAssignment
1060,377,"Hi, yes I'm interested. Is it possible to do a remote tour? I'm actually moving to San Francisco for a job so I'm not in the city yet.",virtualTour
1061,51,Okay thank.  I apologize for not getting back to you quickly.  Moving is not fun when it's just you.,unknown
1062,1013,Ok,unknown
1063,438,Parking?,parking
1064,264,But that's still pricey,unitAssignment
1065,1108,Where is the lease office,leaseOfficeDirection
1066,954,can resident sublease,sublease
1067,1164,"Hi Kelsey, thank you for reaching out! Before I come in I just have a couple of questions. What amenities do you offer at the property?",amenities
1068,706,I want to book a tour.,tourBooking
1069,1176,2 bed 2 bath,unitAssignment
1070,432,I am currently in San Diego and would like a virtual tour today or tomorrow,virtualTour
1071,681,can i come for tour?,tourBooking
1072,5,I would!,unknown
1073,1275,Yes what are the requirements for move in?,moveInCost
1074,1080,what be all the fee -PRON- charge for new renter,moveInCost
1075,809,can i have a dog at the apartment,pet
1076,1393,And if so how much are they going for?,unitAssignment
1077,1263,More info for rent,unitAssignment
1078,1034,How much is it?,unitAssignment
1079,116,what be -PRON- pet policy,pet
1080,1240,Virtual would be perfect,virtualTour
1081,211,I try all day but no answer,unknown
1082,1194,Do u have one bedroom apartment available?,unitAssignment
1083,803,I'm trying to complete the application online but it keeps saying to fill out all of the required information but I have filled out all information fields ,unknown
1084,408,Yes I would like to know more about the apartment,unknown
1085,401,Not just yet. What are 2bd prices and what's include?,unitAssignment
1086,1453,Somewhat! I am just not interested in setting up an account right now! ,notInterested
1087,956,tomorrow 3 pm,tourBooking
1088,801,Perfect! Whats the pricing on that,unitAssignment
1089,271,"Hello, I would like to schedule a tour for Saturday 13, I would like to see studio #302",tourBooking
1090,200,Any specials,leasingOfficePromotion
1091,547,what kind of amenity do -PRON- have,amenities
1092,624,where be -PRON-,community_address
1093,1320,are there breed restrictions on dogs?,pet
1094,856,?,unknown
1095,655,I am looking for 2 beds and two baths,unitAssignment
1096,721,Okay sounds good,unknown
1097,984,Please describe how rent is collected and any applicable policies.,rentPaymentPolicy
1098,623,Yes I would like to schedule a tour do you have any available,tourBooking
1099,331,Yes what is the availability you guys have ?,unitAssignment
1100,32,How far are u guys from Rosharon tx or pearland,unknown
1101,731,That would be awesome,unknown
1102,880,Yeah that'll work,unknown
1103,45,Get you some sleep god,unknown
1104,1035,Muchas gracias,unknown
1105,1221,Can you tell me what do I need to have to lease,applicationProcess
1106,812,"Yes, would like to schedule a tour. I close from work at 5:30 p.m. Will be available after work. 
Thanks.",tourBooking
1107,878,What's the best option  for me in the mission for a studio?,unitAssignment
1108,193,how do i book a tour,tourBooking
1109,595,3 bedrooms move in time maybe or June,unitAssignment
1110,1113,do -PRON- allow pet,pet
1111,1087,Yes pleas,unknown
1112,49,I can make that happen,unknown
1113,651,be cat allow,pet
1114,913,do you allow dogs,pet
1115,1094,can i get a short term lease,leasePeriod
1116,422,What's ur price on the 1 bedrooms,unitAssignment
1117,204,Hi Kelsey. Would that still be possible?,unknown
1118,972,be there a gym for resident,gym
1119,638,can you tell me the apartment name?,community_name
1120,934,do -PRON- have a gym,gym
